{
  "id": "stratum-formal-spec-v2.5",
  "title": "STRATUM Formal Specification",
  "version": "2.5.0-alpha",
  "namespace": "stratum.spec",
  "description": "A layered specification framework for describing complex artifacts with formal guarantees",
  "sections": [
    {
      "id": "sec-XYQxS3DjhGgZ24R6PyyfR",
      "number": 1,
      "title": "Foundations",
      "contentRef": "sec-XYQxS3DjhGgZ24R6PyyfR.json"
    },
    {
      "id": "sec-ggoNjElo79ZXKuYjlF7mW",
      "title": "STRATUM in Action: Requirement Change Impact",
      "contentRef": "sec-ggoNjElo79ZXKuYjlF7mW.json"
    },
    {
      "id": "sec-8qxwzRxMeEWqbne8C5K8l",
      "number": 2,
      "title": "Abstract Syntax",
      "contentRef": "sec-8qxwzRxMeEWqbne8C5K8l.json"
    },
    {
      "id": "sec-A6gecSxlJYGPIDKvgzjsG",
      "title": "Policy [v2.5]",
      "contentRef": "sec-A6gecSxlJYGPIDKvgzjsG.json"
    },
    {
      "id": "sec-pYrht_aqaJ5gENPPS98r-",
      "number": 3,
      "title": "Well-Formedness Conditions",
      "contentRef": "sec-pYrht_aqaJ5gENPPS98r-.json"
    },
    {
      "id": "sec-taGb2W-Ks5lKWB8hcj3UY",
      "number": 4,
      "title": "Semantic Properties (The Seven Guarantees)",
      "contentRef": "sec-taGb2W-Ks5lKWB8hcj3UY.json"
    },
    {
      "id": "sec-Jcn-W5ZXGpackkeeq-isa",
      "number": 5,
      "title": "Type System",
      "contentRef": "sec-Jcn-W5ZXGpackkeeq-isa.json"
    },
    {
      "id": "sec-CwnDzo78GYBw57r1EI_R5",
      "number": 6,
      "title": "Inference Rules",
      "contentRef": "sec-CwnDzo78GYBw57r1EI_R5.json"
    },
    {
      "id": "sec-aBNKnM08R3W5pfjELaQas",
      "number": 7,
      "title": "Operations",
      "contentRef": "sec-aBNKnM08R3W5pfjELaQas.json"
    },
    {
      "id": "sec-FzfSSWJ73nYlWnpzz3-B7",
      "number": 8,
      "title": "Domain Profiles",
      "contentRef": "sec-FzfSSWJ73nYlWnpzz3-B7.json"
    },
    {
      "id": "sec-xEbsOCjQmAy1Uj_H6qRLr",
      "number": 9,
      "title": "Extension Mechanism",
      "contentRef": "sec-xEbsOCjQmAy1Uj_H6qRLr.json"
    },
    {
      "id": "sec-Xu_Ovl71oIhLU1kaCurK_",
      "number": 10,
      "title": "Formal Properties and Theorems",
      "contentRef": "sec-Xu_Ovl71oIhLU1kaCurK_.json"
    },
    {
      "id": "sec-TmlplXlhpu2gAP4_iKrgd",
      "number": 11,
      "title": "Reference Implementation",
      "contentRef": "sec-TmlplXlhpu2gAP4_iKrgd.json"
    },
    {
      "id": "sec-aAgCXhEN9t0xxoeTpf0Qc",
      "number": 13,
      "title": "Concurrency Semantics",
      "contentRef": "sec-aAgCXhEN9t0xxoeTpf0Qc.json"
    },
    {
      "id": "sec-5jP_ZWlaA8SfDbhVxrG99",
      "number": 14,
      "title": "Binding Verification Lifecycle",
      "contentRef": "sec-5jP_ZWlaA8SfDbhVxrG99.json"
    },
    {
      "id": "sec-YFHOeAjN2dYDjDiTocSSI",
      "number": 16,
      "title": "Schema Evolution",
      "contentRef": "sec-YFHOeAjN2dYDjDiTocSSI.json"
    },
    {
      "id": "sec-z3nlCPJ5B1h7TUhEf25LL",
      "number": 17,
      "title": "Certification Artifacts",
      "contentRef": "sec-z3nlCPJ5B1h7TUhEf25LL.json"
    },
    {
      "id": "sec-S3Z17-kDEc2A9A92Y0bqi",
      "number": 18,
      "title": "Tool Qualification Guidance (DO-330)",
      "contentRef": "sec-S3Z17-kDEc2A9A92Y0bqi.json"
    },
    {
      "id": "sec-PAskKN4i1etyZhtOY5xtv",
      "number": 19,
      "title": "Mechanized Proof Templates",
      "contentRef": "sec-PAskKN4i1etyZhtOY5xtv.json"
    },
    {
      "id": "sec-ojM0_ZLauOdjNuKK99Pg0",
      "number": 20,
      "title": "Per-Language INV-1..5 Implementation Checklists",
      "contentRef": "sec-ojM0_ZLauOdjNuKK99Pg0.json"
    },
    {
      "id": "sec-dIOSpm6loMFLin3AzkYRN",
      "number": 21,
      "title": "Compositional Semantics",
      "contentRef": "sec-dIOSpm6loMFLin3AzkYRN.json"
    },
    {
      "id": "sec-LUj58UniUYiDJ-BI2QMU3",
      "number": 22,
      "title": "Temporal Properties",
      "contentRef": "sec-LUj58UniUYiDJ-BI2QMU3.json"
    },
    {
      "id": "sec-ZBsFkK5bvDEL4m-rsfH17",
      "number": 23,
      "title": "Constraint Conflict Resolution",
      "contentRef": "sec-ZBsFkK5bvDEL4m-rsfH17.json"
    },
    {
      "id": "sec-RBDT59WZE2xJyi9k5UFvY",
      "number": 24,
      "title": "Garbage Collection Proofs",
      "contentRef": "sec-RBDT59WZE2xJyi9k5UFvY.json"
    },
    {
      "id": "sec-rRDDwm1LZy_CFk7nC2L0k",
      "number": 26,
      "title": "Certification Objective Coverage Matrix",
      "contentRef": "sec-rRDDwm1LZy_CFk7nC2L0k.json"
    },
    {
      "id": "sec-Nei3FTlw11oOPZVBq920l",
      "number": 27,
      "title": "STPA/FMEA Integration Framework",
      "contentRef": "sec-Nei3FTlw11oOPZVBq920l.json"
    },
    {
      "id": "sec-x6eVbGvoVfS9GNeqNkLUG",
      "number": 28,
      "title": "Formal Attenuation Properties",
      "contentRef": "sec-x6eVbGvoVfS9GNeqNkLUG.json"
    },
    {
      "id": "sec-dM0e66FHuNRBmoEaMjfxF",
      "number": 29,
      "title": "Cross-Standard Traceability Matrix",
      "contentRef": "sec-dM0e66FHuNRBmoEaMjfxF.json"
    },
    {
      "id": "sec-F4EMqD3954zBnfEDnmQGj",
      "number": 30,
      "title": "Tier Boundary Formal Semantics",
      "contentRef": "sec-F4EMqD3954zBnfEDnmQGj.json"
    },
    {
      "id": "sec-FKg-HIOFmN1Oiyr_KJhnT",
      "number": 12,
      "title": "Summary",
      "contentRef": "sec-FKg-HIOFmN1Oiyr_KJhnT.json"
    },
    {
      "id": "sec-Ksy2-gPkkxdYKBYNqe76U",
      "number": 31,
      "title": "Glossary of Key Terms",
      "contentRef": "sec-Ksy2-gPkkxdYKBYNqe76U.json"
    },
    {
      "id": "sec-syYS1lzON5CBCL1ZdsBul",
      "number": 32,
      "title": "Comprehensive Bibliography",
      "contentRef": "sec-syYS1lzON5CBCL1ZdsBul.json"
    }
  ],
  "meta": {
    "createdAt": "2025-12-26T14:15:03.322240Z",
    "updatedAt": "2025-12-26T14:15:03.322240Z",
    "generatedAt": "2025-12-26T14:15:03.322240Z",
    "authors": [],
    "keywords": [
      "formal specification",
      "layered architecture",
      "traceability",
      "dependency management",
      "type system",
      "constraint validation",
      "cascade propagation",
      "CRDT",
      "concurrency",
      "verification lifecycle",
      "query language",
      "schema evolution",
      "distributed consensus",
      "incremental validation"
    ],
    "domains": [
      "Software Systems",
      "Organizations",
      "Manufacturing",
      "Healthcare",
      "Legal",
      "Enterprise Architecture"
    ],
    "abstract": "STRATUM v2.5.0-alpha introduces conformance levels (K0-K3) and adds the seventh guarantee G7 (Explainability). This ALPHA release defines the Kernel (K0) as a 2-hour reading path covering core data structures, well-formedness, six guarantees (G1-G6), and basic operations. K1 (Certified-Aware) adds G7 with irreducible unsat cores and the Policy System for automated remediation. Building on v2.4.4, this version includes: (1) schema evolution with compatibility rules (§16), (2) STPA/FMEA hazard integration (§27), (3) formal attenuation properties (§28), (4) cross-standard DO-178C ↔ ISO 26262 traceability (§29), (5) LSL-style tier boundary semantics (§30), and (6) comprehensive 100+ term glossary (§30). The specification maintains backward compatibility while enabling regulated industry adoption through explicit conformance tiers. Document Structure at a Glance: PART I: Foundations (Sections 1-6) Core type system, abstract syntax, well-formedness, guarantees, and inference rules."
  },
  "subtitle": "A Formal System for Specifying Complex Artifacts",
  "documentType": "article",
  "documentStruct": "parts",
  "parts": [
    {
      "id": "part-01",
      "number": 1,
      "title": "Foundations",
      "summary": "Core type system, abstract syntax, well-formedness, guarantees, and inference rules.",
      "sections": [
        "sec-XYQxS3DjhGgZ24R6PyyfR",
        "sec-ggoNjElo79ZXKuYjlF7mW",
        "sec-8qxwzRxMeEWqbne8C5K8l",
        "sec-A6gecSxlJYGPIDKvgzjsG",
        "sec-pYrht_aqaJ5gENPPS98r-",
        "sec-taGb2W-Ks5lKWB8hcj3UY",
        "sec-Jcn-W5ZXGpackkeeq-isa",
        "sec-CwnDzo78GYBw57r1EI_R5"
      ]
    },
    {
      "id": "part-02",
      "number": 2,
      "title": "Operations",
      "summary": "Query, modification, domain profiles, and extensibility.",
      "sections": [
        "sec-aBNKnM08R3W5pfjELaQas",
        "sec-FzfSSWJ73nYlWnpzz3-B7",
        "sec-xEbsOCjQmAy1Uj_H6qRLr"
      ]
    },
    {
      "id": "part-03",
      "number": 3,
      "title": "Formal Theory",
      "summary": "Theorems, proofs, concurrency semantics, certification, and advanced properties.",
      "sections": [
        "sec-Xu_Ovl71oIhLU1kaCurK_",
        "sec-aAgCXhEN9t0xxoeTpf0Qc",
        "sec-5jP_ZWlaA8SfDbhVxrG99",
        "sec-YFHOeAjN2dYDjDiTocSSI",
        "sec-dIOSpm6loMFLin3AzkYRN",
        "sec-LUj58UniUYiDJ-BI2QMU3",
        "sec-ZBsFkK5bvDEL4m-rsfH17",
        "sec-RBDT59WZE2xJyi9k5UFvY",
        "sec-x6eVbGvoVfS9GNeqNkLUG",
        "sec-F4EMqD3954zBnfEDnmQGj"
      ]
    },
    {
      "id": "part-04",
      "number": 4,
      "title": "Implementation",
      "summary": "Reference implementation, proof templates, and language checklists.",
      "sections": [
        "sec-TmlplXlhpu2gAP4_iKrgd",
        "sec-PAskKN4i1etyZhtOY5xtv",
        "sec-ojM0_ZLauOdjNuKK99Pg0"
      ]
    },
    {
      "id": "part-05",
      "number": 5,
      "title": "Certification",
      "summary": "Certification artifacts, tool qualification, coverage matrices, STPA/FMEA, and traceability.",
      "sections": [
        "sec-z3nlCPJ5B1h7TUhEf25LL",
        "sec-S3Z17-kDEc2A9A92Y0bqi",
        "sec-rRDDwm1LZy_CFk7nC2L0k",
        "sec-Nei3FTlw11oOPZVBq920l",
        "sec-dM0e66FHuNRBmoEaMjfxF"
      ]
    },
    {
      "id": "part-06",
      "number": 6,
      "title": "Appendices",
      "summary": "Summary, glossary, and bibliography.",
      "sections": [
        "sec-FKg-HIOFmN1Oiyr_KJhnT",
        "sec-Ksy2-gPkkxdYKBYNqe76U",
        "sec-syYS1lzON5CBCL1ZdsBul"
      ]
    }
  ]
}
